Sheet: front page
C2: IKEJA ELECTRICITY DISTRIBUTION COMPANY
I4: 700
A5: SANCTION IDENTIFICATION
A6: PHCN EXPENDITURE SANCTION- (To be completed by District/ Zonal Accounts)
A7: REQUEST FOR DISTRIBUTION EXTENSION
F8: 40-200
A9: PART 1: SUMMARY
A11: Location: | D11: Date
A12: 1 | B12: PROJECT DESCRIPTION: 700 | H12: Insert X as applicable
B13: PROPOSED LINKING OF NEW ALAUSA 11KV FDR WITH AWOLOWO 11KV FDR | G13: New Extension
B14: TO RELIEVE EXISTING AKEREDOLU 300KVA | G14: Reinforcement | I14: x
B15: 11/0.415KV T/F S/S | G15: Reconstruction
B16: AKUTE UNDERTAKING, OJODU BUSINESS UNIT | G16: Minor Works
B17: Estimated Commencement Date: ON APPROVAL Completion DateSOONEST.
A19: 2. COST ANALYSIS SUMMARY (details Part III)
C21: A | D21: Materials ( excluding Transformers) | H21: (See Part IV) | I21: =PRODUCT(1,('Material listing'!R[85]C[3]:R[85]C[4])) -> 3329604.75
C22: B | D22: Labour | H22: (See Part III)
C23: C | D23: Transport | H23: (See Part III) | I23: =PRODUCT(1,('Material listing'!R[-5]C[-5]:R[-5]C[-4])) -> 83240.118750000009
C24: D | D24: Contracts | H24: (See Part III) | I24: =PRODUCT(1,('Material listing'!R[11]C[-3])) -> 1146731.25
C25: E | D25: Land & Wayleaves | H25: (See Part III) | I25: -
C26: F | D26: TOTAL EXPENDITURE (excluding Transformers) | I26: =SUM(R[-5]C:R[-1]C) -> 4559576.1187500004
C27: A/I | D27: Transformer Cost | H27: (See Part IV)
C28: G | D28: SUB - TOTAL | I28: =SUM(R[-2]C:R[-1]C) -> 4559576.1187500004
C29: H | D29: On - Cost Charge | H29: (7.5...% of G) | I29: 0
C30: I | D30: Headquarters Charge | H30: (5...% of G) | I30: 0
C31: J | D31: GROSS COST | I31: =SUM(R[-3]C:R[-1]C) -> 4559576.1187500004
C32: K | D32: Contributed Capital | I32: -
C33: L | D33: NET COST (J - K) | I33: =SUM(R[-2]C:R[-1]C) -> 4559576.1187500004
A36: 3 | B36: ANALYSIS OF ANNUAL AUTHORISATION (to be completed by District/Zonal | I36: ..
G37: Accounts) | I37: District/Zonal Accountant
B38: Total Annual Authorisation
B39: Amount Previously Authorised
B40: Amount of this request | F40: F | H40: =R[-14]C[1] -> 4559576.1187500004
A41: , | B41: Balance Available/Augmentation Required
A44: 4) SANCTION AUTHORISATION
C45: Prepared By | E45: Checked By | F45: Reviewed By | H45: Recommended By | I45: Approved By
B46: Name
B47: Position
B48: Signature
B49: Date
H50: Approved Amount J | I50: =R[-19]C -> 4559576.1187500004
I51: Form PHCN 190
I52: Revised Dec. 1992

Sheet: Tech Description
A1: PART II : TECHNICAL (Drawing Must be attached to each copy of request)

Sheet: Material listing
C3: IKEJA ELECTRICITY DISTRIBUTION COMPANY.
A5: PART III: ANALYSIS OF PROJECT COSTS | F5: (To be completed by District Accounts)
A10: LABOUR 10% | C10: B | I10: LAND & WAYLEAVES Total | K10: B
A11: Category | B11: Man/Days | C11: Rate | D11: Amount | I11: Description | L11: Amount
A12: Snr. Service | I12: Compensation - Crops
A13: Jnr. Service | I13: Compensation - Building
A14: Daily Paid | I14: Bush Clearing
A15: Contingencies
I16: Contingencies
A18: TRANSPORT 2.5% | C18: C | D18: =0.025*R[88]C[8] -> 83240.118750000009
A19: Type of Unit | B19: Days | C19: Rate | D19: Total
I21: 360 | J21: Land & Wayleaves
A23: Contingencies | I23: 361 | J23: Buildings
I25: 362/02 | J25: Substation Switchgear | M25: =R[28]C[-1] -> 146850
A26: CONTRACT | E26: =R[10]C[1] -> 0
A27: Description: | E27: Rate | F27: Amount | I27: 363 | J27: Underground Conductor | M27: =R[44]C[-1] -> 1678370
A28: [1] T/F & F/P Plinth
A29: [2] Fencing of s/s | I29: 364 | J29: Overhead Conductor | M29: =R[73]C[-1] -> 1504384.75
A30: [3] Digging of central earth pit
A31: [4] Digging of holes for Poles | J31: General Cost | M31: =SUM(R[-21]C[-9],R[-13]C[-9],R[-5]C[-8]) -> 83240.118750000009
A32: (5) Digging of holes for Stays
A33: [5] Drilling & cutting of channel iron
A34: Contingencies 10%
A35: Sub Total | F35: ='Contract Form'!R[-5]C -> 1146731.25
A36: (See Contract form attached Details as attched) | I36: 1
I37: SUB TOTAL COST | L37: F | M37: =SUM(R[-12]C:R[-1]C) -> 3412844.8687499999
I38: 362/01 | J38: Substation Transformers
I39: 365 | J39: Distribution Transfromers | M39: =R[66]C[-3] -> 2120000
I41: TOTAL GROSS COST | L41: G | M41: =SUM(R[-4]C:R[-1]C) -> 5532844.8687500004
A43: PART IV : MATERIALS LISTING | D43: (Requst For Distribution Extension)
A44: Vocab/ | B44: Description (362) | H44: Quantity
A45: Stock Code | B45: 362/02 substation switch gear materials | H45: Required | J45: Unit | L45: Total
A46: 441-0060 | B46: 11KV J&P 'D' fuse assy | H46: 0 | I46: set | J46: 42000 | L46: =RC[-4]*RC[-2] -> 0
A47: 452-0109 | B47: 11KV Lightning arrestors | H47: 1 | I47: set | J47: 25000 | L47: =RC[-4]*RC[-2] -> 25000
A48: 119-0550 | B48: Galvanized earth rod | H48: 10 | I48: No | J48: 2450 | L48: =RC[-4]*RC[-2] -> 24500
A49: 464-1037 | B49: 70mm2 copper earth wire | H49: 40 | I49: mtrs | J49: 2000 | L49: =RC[-4]*RC[-2] -> 80000
A50: 464-1037 | B50: 4-Way feeder pillar | I50: no | J50: 165000 | L50: =RC[-4]*RC[-2] -> 0
B51: Sundries | H51: lots | J51: - | L51: 4000
B52: Contingencies | H52: 10 | I52: % | J52: - | L52: =0.1*(SUM(R[-6]C,R[-5]C,R[-4]C,R[-3]C,R[-1]C,)) -> 13350
B53: SUB-TOTAL | I53: - | J53: - | L53: =SUM(R[-7]C,R[-6]C,R[-5]C,R[-4]C,R[-2]C,R[-1]C) -> 146850
L54: Form PHCN 190
A56: PART IV : MATERIALS LISTING (REQUEST FOR DISTRIBUTION EXTENSION)
A57: Vocab/ | B57: Description (363) | I57: Quantity | J57: VALUE
A58: Stock Code | B58: 363-Underground Materials | I58: Required | J58: Unit | L58: Total
A59: 462-2792 | B59: 500mm2x1core cable | I59: mtrs | J59: 14500 | L59: =RC[-4]*RC[-2] -> 0
A60: 462-2792 | B60: 35MM2 X 1 core XLPE cable | I60: mtrs | J60: 1500 | L60: =RC[-4]*RC[-2] -> 0
A61: 465-1143 | B61: 150mm2 x 3core XLPE cable | H61: 100 | I61: mtrs | J61: 14500 | L61: =RC[-4]*RC[-2] -> 1450000
A62: 479-9007 | B62: Raychem term. Kit (150mm2 - 185mm2) XLPE I/D | H62: 1 | I62: kit | J62: 16000 | L62: =RC[-4]*RC[-2] -> 16000
A63: 479-9012 | B63: Raychem term. Kit for XLPE O/D | H63: 1 | I63: kit | J63: 18000 | L63: =RC[-4]*RC[-2] -> 18000
A64: 470-0019 | B64: 70MM2 CABLE SOCKET | H64: 2 | I64: no | J64: 350 | L64: =RC[-4]*RC[-2] -> 700
A65: 470-0019 | B65: 500MM2 CABLE SOCKET | I65: no | J65: 1750 | L65: =RC[-4]*RC[-2] -> 0
B66: 150MM2 CABLE SOCKET | H66: 6 | I66: no | J66: 650 | L66: =RC[-4]*RC[-2] -> 3900
A67: 469-0779 | B67: Bimetallic line tap | H67: 3 | I67: no | J67: 3000 | L67: =RC[-4]*RC[-2] -> 9000
B68: Universal line tap | H68: 9 | I68: no | J68: 3000 | L68: =RC[-4]*RC[-2] -> 27000
B69: Sundries | H69: lots | J69: 4000 | L69: =RC[-2] -> 4000
B70: Contingencies | I70: 0.1 | J70: - | L70: =0.1*(SUM(R[-11]C,R[-9]C,R[-8]C,R[-7]C,R[-6]C,R[-3]C,R[-1]C)) -> 149770
B71: Sub-Total | L71: =SUM(R[-12]C:R[-1]C[1]) -> 1678370
B73: 364 -Overhead Materials
A74: 191-0435 | B74: 10.06m Concrete pole | H74: 14 | I74: no | J74: 34000 | L74: =RC[-4]*RC[-2] -> 476000
A75: 191-0435 | B75: 8.53M Concrete pole | I75: no | J75: 26000 | L75: =RC[-4]*RC[-2] -> 0
A76: 239-0880 | B76: 4"x3"x6' Channel Iron | H76: 8 | I76: no | J76: 6500 | L76: =RC[-4]*RC[-2] -> 52000
A77: 190-0129 | B77: 11KV Tie Strap | H77: 10 | I77: Pair | J77: 620 | L77: =RC[-4]*RC[-2] -> 6200
A78: - | B78: Wooden Cross arm | H78: 0 | I78: no | J78: 3000 | L78: =RC[-4]*RC[-2] -> 0
A79: - | B79: Terminating Strap | I79: no | L79: =RC[-4]*RC[-2] -> 0
B80: D-iron | I80: no | J80: 300 | L80: =RC[-4]*RC[-2] -> 0
B81: Shackle Insulator | I81: no | J81: 300 | L81: =RC[-4]*RC[-2] -> 0
B82: 70mm2 Stay Wire | H82: 105 | I82: mtrs | J82: 300 | L82: =RC[-4]*RC[-2] -> 31500
B83: Stay Block | H83: 7 | I83: no | J83: 1000 | L83: =RC[-4]*RC[-2] -> 7000
B84: Stay Insulator | H84: 7 | I84: no | J84: 350 | L84: =RC[-4]*RC[-2] -> 2450
B85: Stay Rod | H85: 7 | I85: no | J85: 2080 | L85: =RC[-4]*RC[-2] -> 14560
A86: 479-0336 | B86: J - Hook | H86: 18 | I86: no | J86: 850 | L86: =RC[-4]*RC[-2] -> 15300
A87: 190-0168 | B87: 6 - Bolts Clamp | H87: 18 | I87: no | J87: 1950 | L87: =RC[-4]*RC[-2] -> 35100
A88: 190-0390 | B88: Adaptor Socket | H88: 18 | I88: no | J88: 900 | L88: =RC[-4]*RC[-2] -> 16200
A89: 476-0226 | B89: Disc Insulator | H89: 18 | I89: no | J89: 2000 | L89: =RC[-4]*RC[-2] -> 36000
A90: 149-0632 | B90: 11kv Fibre Cross Arm | H90: 8 | I90: no | J90: 14430 | L90: =RC[-4]*RC[-2] -> 115440
B91: 11KV Pin Insulator | H91: 33 | I91: nos | J91: 1200 | L91: =RC[-4]*RC[-2] -> 39600
A92: - | B92: Spindle | H92: 33 | I92: no | J92: 600 | L92: =RC[-4]*RC[-2] -> 19800
A93: 460-0062 | B93: 150MM2 Aluminum Conductor | H93: 1485 | I93: mtrs | J93: 318.5 | L93: =RC[-4]*RC[-2] -> 472972.5
B94: Rapid Rupturing Fuses | I94: No | J94: 750 | L94: =RC[-4]*RC[-2] -> 0
A95: 200-0187 | B95: 5/8 x 2 bolt & nut | H95: 7 | I95: no | J95: 300 | L95: =RC[-4]*RC[-2] -> 2100
A96: 200-0195 | B96: 5/8 X 6 Bolt & Nut | H96: 16 | I96: no | J96: 300 | L96: =RC[-4]*RC[-2] -> 4800
A97: 200-0207 | B97: 5/8 x 8 bolt & nut | H97: 16 | I97: no | J97: 300 | L97: =RC[-4]*RC[-2] -> 4800
A98: 200-0195 | B98: 5/8 X 10 Bolt & Nut | H98: 8 | I98: no | J98: 300 | L98: =RC[-4]*RC[-2] -> 2400
A99: 200-0207 | B99: 5/8 Galvanized washer | H99: 94 | I99: no | J99: 100 | L99: =RC[-4]*RC[-2] -> 9400
B100: Sundries | H100: lot | J100: 4000 | L100: =RC[-2] -> 4000
B101: Contingencies | H101: 10 | I101: % | J101: - | L101: =0.1*(SUM(R[-27]C:R[-1]C[1])) -> 136762.25
B102: SUB-TOTAL | L102: =SUM(R[-28]C:R[-1]C) -> 1504384.75
B104: 365 - DISTRIBUTION TRANSFORMER
A105: 430-0150 | B105: 500KVA 11/0.415KV Transformer | I105: No | J105: 2120000 | L105: =RC[-2] -> 2120000
J106: A | L106: =SUM(R[-4]C,R[-35]C,R[-53]C) -> 3329604.75
J107: A/1 | L107: =R[-2]C -> 2120000
I108: TOTAL COST | L108: =SUM(R[-2]C:R[-1]C) -> 5449604.75
M110: PHCN 190
A113: Location Budget Request Contract Year of
A114: Code Item Number Number Sanction

Sheet: Contract Form
A1: CONTRACT ANALYSIS OF PROPOSED FEMI OTITOLOJU 500KVA 11/0.415KV SUBSTATION, OFF AKEREDOLU AKUTE UNDERTAKING OJODU BUSINESS UNIT.
A2: S/No | B2: Description | C2: Quantity | E2: Unit Price | F2: Amount
C3: Qty | D3: Unit
A4: A | B4: OVER HEAD WORK
A5: 1 | B5: Surveying and Pegging | C5: 1 | D5: Lot | E5: 65000 | F5: =RC[-3]*RC[-1] -> 65000
A6: 2 | B6: Make Transformer and Feeder Pillar Plinth | C6: 1 | D6: Lot | E6: 65000 | F6: =RC[-3]*RC[-1] -> 65000
A7: 3 | B7: Digging of holes for poles and stays | C7: 21 | D7: No | E7: 3500 | F7: =RC[-3]*RC[-1] -> 73500
A8: 4 | B8: Complete Stay & Weaving | C8: 6 | D8: No | E8: 3250 | F8: =RC[-3]*RC[-1] -> 19500
A9: 5 | B9: Erection of Pole | C9: 15 | D9: No | E9: 6500 | F9: =RC[-3]*RC[-1] -> 97500
A10: 6 | B10: Pole Dressing | C10: 15 | D10: No | E10: 3575 | F10: =RC[-3]*RC[-1] -> 53625
A11: 7 | B11: Stringing of HT Over Head line | C11: 13 | D11: Spans | E11: 9750 | F11: =RC[-3]*RC[-1] -> 126750
A12: 8 | B12: Stringing of LT Over Head line | C12: 4 | D12: Spans | E12: 9750 | F12: =RC[-3]*RC[-1] -> 39000
A13: 9 | B13: Hiring of Security | C13: Lot | D13: - | E13: - | F13: 150000
A14: 10 | B14: Beaming of Poles | C14: 15 | D14: No | E14: 7150 | F14: =RC[-3]*RC[-1] -> 107250
B15: Sub Total | F15: =SUM(R[-10]C:R[-1]C) -> 797125
A16: B | B16: TRANSPORT
A17: 1 | B17: Haulage of poles | C17: 2 | D17: Trip | E17: 65000 | F17: =RC[-3]*RC[-1] -> 130000
A18: 2 | B18: Movement of Transformer to site | C18: 1 | D18: Trip | E18: 65000 | F18: =RC[-3]*RC[-1] -> 65000
A19: 3 | B19: Hiring of Trailer and Labour for material movement to site | C19: 1 | D19: No | E19: 75000 | F19: =RC[-3]*RC[-1] -> 75000
B20: Sub Total | F20: =SUM(R[-3]C:R[-1]C) -> 270000
A21: C | B21: UNDERGROUND CABLE WORK
A22: 1 | B22: Termination of HT cable | C22: 1 | D22: No. | E22: 25000 | F22: =RC[-1]*RC[-3] -> 25000
B23: Sub Total | F23: =SUM(R[-1]C:R[-1]C) -> 25000
A24: D | B24: SUMMARY
A25: 1 | B25: OVER HEAD WORK | F25: =R[-10]C -> 797125
A26: =R[-1]C+1 -> 2 | B26: TRANSPORT | F26: =R[-6]C -> 270000
A27: 3 | B27: UNDERGROUND CABLE WORK | F27: =R[-4]C -> 25000
B28: Sub Total | F28: =SUM(R[-3]C:R[-1]C) -> 1092125
B29: VAT | C29: 0.05 | F29: =R[-1]C*0.05 -> 54606.25
B30: Grand Total | F30: =SUM(R[-2]C:R[-1]C) -> 1146731.25